Title,Link,Date 
Join us in a Digital Climate Strike, https://en.blog.wordpress.com/2019/09/12/digital-climate-strike/, September 12 2019 
WordPress.com and Fiverr Partner to Launch “WordPress.com Fundamentals” Course, https://en.blog.wordpress.com/2019/09/11/wordpress-com-fiverr-video-course/, September 11 2019 
When Experienced Women Engineers Look for New Jobs, They Prioritize Trust and Growth, https://en.blog.wordpress.com/2019/08/28/hiring-women-engineers/, August 28 2019 
The Second Edition of Our “Learn User Support” Workshop Is Open for Signups, https://en.blog.wordpress.com/2019/08/10/the-second-edition-of-our-learn-user-support-workshop-is-open-for-signups/, August 10 2019 
Four New WordPress.com Color Schemes, https://en.blog.wordpress.com/2019/07/24/four-new-wordpress-com-color-schemes/, July 24 2019 
More Stats, Better Stats, Faster Stats: A Whole New Mobile Experience, https://en.blog.wordpress.com/2019/07/16/more-stats-better-stats-faster-stats-a-whole-new-mobile-experience/, July 16 2019 
Want to See a More Diverse WordPress Contributor Community? So Do We., https://en.blog.wordpress.com/2019/06/19/want-to-see-a-more-diverse-wordpress-contributor-community-so-do-we/, June 19 2019 
Celebrating Pride Month with WordPress.com, https://en.blog.wordpress.com/2019/06/03/celebrating-pride-month-with-wordpress-com/, June 3 2019 
Publishing to WordPress from Bear Just Got Better, https://en.blog.wordpress.com/2019/05/13/publishing-to-wordpress-from-bear-just-got-better/, May 13 2019 
Boost Visitor Engagement and Grow Your Mailing List with the Mailchimp Block, https://en.blog.wordpress.com/2019/04/11/boost-visitor-engagement-and-your-mailing-list-with-the-mailchimp-block/, April 11 2019 
